,Property,Value
0,Number of S-S Bonds,0
1,Number of Salt-bridges,14
2,Number of H-bonds,9
3,Number of Water mediated contacts,0
4,Number of CH-O/N bonds,13
5,Number of Halogen bonds,0
6,Number of Metal mediated contacts,0
7,Number of π-π interactions,0
8,Number of lp-π interactions,1
9,Number of Anion-π interactions,0
10,Number of Cation-π interactions,1
11,Number of Amino-π interactions,0
12,Number of O/N/SH-π interactions,0
13,Number of CH-π interactions,2
14,Number of Polar vdW contacts,0
15,Number of Apolar vdW contacts,3
16,Number of Clashes,3
17,Number of Proximal contacts,36
